Codigo_Pro|Nombre|Marca|Descripcion|Moneda|Precio|Precio_Valido_Hasta|Url_producto|Url_Imagen|Almacen|Cantidad|Fecha|Categoria
22018|arroz vitarroz plus supremo x 10 kg|SUPREMO|Arroz Supremo Premium es símbolo de la excelencia del arroz Colombiano, llevalo a tu casa con tan solo un click en tiendasjumbo.co|COP|44290.0|2023-10-14T22:12:59Z|https://www.tiendasjumbo.co/arroz-vitarroz-plus-supremo-x-10-kg/p|https://jumbocolombiaio.vtexassets.com/arquivos/ids/192008/7701024000276-1.jpg?v=1752531938|Cencosud - Colombia|10 kg|2022-10-18|ARROZ
13397|arroz diana x 10 kg|DIANA|Proporciónale todo el amor a tu familia con el delicioso Arroz Diana|COP|38890.0|2023-10-16T22:03:57Z|https://www.tiendasjumbo.co/arroz-diana-x-10-kg/p|https://jumbocolombiaio.vtexassets.com/arquivos/ids/186325/7702511000205.jpg?v=1752535658|Cencosud - Colombia|10 kg|2022-10-18|ARROZ
111865|arroz cuisine&amp;co blanco x10000 g|CUISINE &amp; CO NBE MP|Arroz cuisine&amp;co blanco x10000g|COP|37490.0|2023-08-28T22:09:46Z|https://www.tiendasjumbo.co/arroz-cuisine-co-blanco-x10000g/p|https://jumbocolombiaio.vtexassets.com/arquivos/ids/213565/7703616303888.jpg?v=1752534822|Cencosud - Colombia|10 kg|2022-10-18|ARROZ
13396|arroz diana x 5 kg|DIANA|Proporciónale todo el amor a tu familia con el delicioso Arroz Diana|COP|19490.0|2023-08-28T22:22:13Z|https://www.tiendasjumbo.co/arroz-diana-x-5-kg/p|https://jumbocolombiaio.vtexassets.com/arquivos/ids/186323/7702511000045.jpg?v=1752536059|Cencosud - Colombia|5 kg|2022-10-18|ARROZ
13376|arroz diana x 25 und x 500 g cu|DIANA|Proporciónale todo el amor a tu familia con el delicioso Arroz Diana.|COP|47990.0|2023-09-04T22:10:04Z|https://www.tiendasjumbo.co/arroz-diana-x-25-und-x-500-g-c-u/p|https://jumbocolombiaio.vtexassets.com/arquivos/ids/186291/7702511000342.jpg?v=1752534181|Cencosud - Colombia|25 und  500 g c/u|2022-10-18|ARROZ
13395|arroz diana x 3 kg|DIANA|Proporciónale todo el amor a tu familia con el delicioso Arroz Diana|COP|11690.0|2023-08-28T22:27:27Z|https://www.tiendasjumbo.co/arroz-diana-x-3-kg/p|https://jumbocolombiaio.vtexassets.com/arquivos/ids/186321/7702511000038.jpg?v=1752536323|Cencosud - Colombia|3 kg|2022-10-18|ARROZ
22006|arroz supremo x 5 kg|SUPREMO|Arroz Supremo contiene una mezcla de vitaminas y minerales que contribuyen a la nutrición de tu familia.Contribuye al crecimiento y desarrollo del cuerpo y, ayuda a fortalecer el sistema inmunológico.Contribuye al buen funcionamiento del sistema inmunológico.|COP|22590.0|2023-10-14T22:12:49Z|https://www.tiendasjumbo.co/arroz-supremo-x-5-kg/p|https://jumbocolombiaio.vtexassets.com/arquivos/ids/191981/7701024000047-1.jpg?v=1752528345|Cencosud - Colombia|5 kg|2022-10-18|ARROZ
13381|arroz diana x 1 kg|DIANA|Proporciónale todo el amor a tu familia con el delicioso Arroz Diana|COP|3990.0|2023-08-28T22:30:17Z|https://www.tiendasjumbo.co/arroz-diana-x-1-kg/p|https://jumbocolombiaio.vtexassets.com/arquivos/ids/186299/7702511000021.jpg?v=1752534191|Cencosud - Colombia|1 kg|2022-10-18|ARROZ
111864|arroz cuisine&amp;co blanco x5000 g|CUISINE &amp; CO NBE MP|Arroz cuisine&amp;co blanco x5000g|COP|18790.0|2023-08-28T22:08:00Z|https://www.tiendasjumbo.co/arroz-cuisine-co-blanco-x5000g/p|https://jumbocolombiaio.vtexassets.com/arquivos/ids/213564/7703616275024.jpg?v=1752533734|Cencosud - Colombia|5 kg|2022-10-18|ARROZ
13389|arroz roa x 10 kg|ROA|arroz descascarado al cual se le ha eliminado totalmente por elaboracion el germen y el salvado con adicion de vitamina A y acido folico|COP|44590.0|2023-08-29T22:01:46Z|https://www.tiendasjumbo.co/arroz-roa-x-10kg/p|https://jumbocolombiaio.vtexassets.com/arquivos/ids/186308/7702552000172.jpg?v=1752534179|Cencosud - Colombia|10 kg|2022-10-18|ARROZ
57911|arroz diana integral x 1000 g|DIANA|Disfruta del mejor arroz en tu mesa y acompáñalo con tus mejores preparaciones|COP|5490.0|2023-09-12T20:02:45Z|https://www.tiendasjumbo.co/arroz-diana-integral-x1000g/p|https://jumbocolombiaio.vtexassets.com/arquivos/ids/207564/7702511003695.jpg?v=1752534396|Cencosud - Colombia|1 kg|2022-10-18|ARROZ
13378|arroz florhuila x 5 kg|FLORHUILA|Disfruta el delicioso sabor del arroz descascarado al cual se le ha eliminado totalmente por elaboración el germen y el salvado con adición de vitamina A y ácido folico.|COP|21990.0|2023-08-28T22:06:26Z|https://www.tiendasjumbo.co/arroz-florhuila-x-5-kg/p|https://jumbocolombiaio.vtexassets.com/arquivos/ids/186295/7702231000042-on-emp-arroz-florhuila-vitaminas-x5000g.jpg?v=1752534174|Cencosud - Colombia|5 kg|2022-10-18|ARROZ
13412|arroz diana premium x 4000 g|DIANA|Diana Premium es el arroz que siempre te hará quedar bien, ya que es 5 veces seleccionado, pasando por los mas estrictos estándares de calidad, para darte granos mas grandes, blancos, y enteros. Un gusto Premium que puedes disfrutar todos los días|COP|23490.0|2023-08-28T22:27:34Z|https://www.tiendasjumbo.co/arroz-diana-premium-x-4000-g/p|https://jumbocolombiaio.vtexassets.com/arquivos/ids/186351/7702511000991.jpg?v=1752521782|Cencosud - Colombia|4 kg|2022-10-18|ARROZ
40865|arroz máxima x25 und x500 g cu|MAXIMA MP|Prepara tus platillos favoritos o acompaña tus recetas con este arroz Maxima que ha sido seleccionado para llevar a tu mesa lo mejor.|COP|42590.0|2023-08-28T22:12:56Z|https://www.tiendasjumbo.co/arroz-maxima-x-25-und-x-500-g-c-u/p|https://jumbocolombiaio.vtexassets.com/arquivos/ids/194728/7703616164359-1.jpg?v=1752528482|Cencosud - Colombia|25 und 500 g c/u|2022-10-18|ARROZ
13379|arroz florhuila x 10 kg|FLORHUILA|Arroz descascarado al cual se le ha eliminado totalmente por elaboracion el germen y el salvado con adicion de vitamina A y acido folico|COP|44590.0|2023-08-28T22:30:15Z|https://www.tiendasjumbo.co/arroz-florhuila-x-10-kg/p|https://jumbocolombiaio.vtexassets.com/arquivos/ids/186297/7702231000066.jpg?v=1752534182|Cencosud - Colombia|10 kg|2022-10-18|ARROZ
56415|arroz roa x5 kg|ROA|Arroz*5kg roa|COP|22290.0|2023-08-28T22:20:14Z|https://www.tiendasjumbo.co/arroz-5kg-roa/p|https://jumbocolombiaio.vtexassets.com/arquivos/ids/195419/7702552000516.jpg?v=1752534177|Cencosud - Colombia|5 kg|2022-10-18|ARROZ
22007|arroz supremo x 3000 g|SUPREMO|Arroz Supremo  es símbolo de la excelencia del arroz Colombiano, llevalo a tu casa con tan solo un click en tiendasjumbo.co|COP|13590.0|2023-10-14T22:04:46Z|https://www.tiendasjumbo.co/arroz-supremo-x-3000-g/p|https://jumbocolombiaio.vtexassets.com/arquivos/ids/191984/7701024000030-20-1.jpg?v=1752533573|Cencosud - Colombia|3 kg|2022-10-18|ARROZ
13410|arroz diana premium x 2.5 kg|DIANA|Diana Premium es el arroz que siempre te hará quedar bien, ya que es 5 veces seleccionado, pasando por los mas estrictos estándares de calidad, para darte granos mas grandes, blancos, y enteros. Un gusto Premium que puedes disfrutar todos los días|COP|15590.0|2023-08-28T22:27:31Z|https://www.tiendasjumbo.co/arroz-diana-premium-x-2-5-kg/p|https://jumbocolombiaio.vtexassets.com/arquivos/ids/186349/7702511000748.jpg?v=1752534189|Cencosud - Colombia|2.5 kg|2022-10-18|ARROZ
56416|arroz roa blanco fortiplus x3000 g|ROA|Arroz roa blanco fortiplus x3000g|COP|12990.0|2023-08-28T22:06:25Z|https://www.tiendasjumbo.co/arroz-roa-blanco-fortiplus-x3000g/p|https://jumbocolombiaio.vtexassets.com/arquivos/ids/195421/7702552000486.jpg?v=1752534176|Cencosud - Colombia|3 kg|2022-10-18|ARROZ
22039|arroz castellano x 2.5 kg|CASTELLANO|Es el único en Colombia que desde la semilla hasta el empaque es concebido para convertirse en el verdadero aliado en la cocina de los que saben diferenciar lo rico de lo exquisito.|COP|22990.0|2023-09-12T20:02:41Z|https://www.tiendasjumbo.co/arroz-castellano-x-2-5-kg/p|https://jumbocolombiaio.vtexassets.com/arquivos/ids/192033/7702206010908.jpg?v=1752534182|Cencosud - Colombia|2.5 kg|2022-10-18|ARROZ
50669|arroz parbolizado doña pepa 1000 g|DONA PEPA|Arroz descascarado al cual se le ha eliminado totalmente por elaboracion el germen y el salvado con adicion de vitamina A y acido folico|COP|6190.0|2023-09-12T20:02:45Z|https://www.tiendasjumbo.co/arroz-parbolizado-dona-pepa-1000g/p|https://jumbocolombiaio.vtexassets.com/arquivos/ids/209449/7702231300029-1.jpg?v=1752534405|Cencosud - Colombia|1 kg|2022-10-18|ARROZ
22009|arroz casanare x 10 kg|CASANARE|El grano de arroz más grande y rendidor. Seleccionado grano a grano desde el cultivo.|COP|41990.0|2023-08-28T22:20:19Z|https://www.tiendasjumbo.co/arroz-casanare-x-10-kg/p|https://jumbocolombiaio.vtexassets.com/arquivos/ids/191987/7703308010131-1.jpg?v=1752534676|Cencosud - Colombia|10 kg|2022-10-18|ARROZ
140195|arroz castellano premium blanco x4000 g|CASTELLANO|Arroz castellano premium blanco x4000g|COP|35990.0|2023-09-12T20:02:49Z|https://www.tiendasjumbo.co/arroz-castellano-premium-blanco-x4000g/p|https://jumbocolombiaio.vtexassets.com/arquivos/ids/214894/7702206299389.jpg?v=1752534343|Cencosud - Colombia|4 kg|2022-10-18|ARROZ
13385|arroz blanco máxima x5 kg|MAXIMA MP|Prepara deliciosas recetas con Arroz blanco maxima.|COP|17590.0|2023-08-28T22:22:21Z|https://www.tiendasjumbo.co/arroz-blanco-maxima-x-5-kg/p|https://jumbocolombiaio.vtexassets.com/arquivos/ids/186305/7703616076515-1.jpg?v=1752515239|Cencosud - Colombia|5 kg|2022-10-18|ARROZ
111866|arroz cuisine&amp;co blanco x3000 g|CUISINE &amp; CO NBE MP|Arroz cuisine&amp;co blanco x3000g|COP|11390.0|2023-08-28T22:06:43Z|https://www.tiendasjumbo.co/arroz-cuisine-co-blanco-x3000g/p|https://jumbocolombiaio.vtexassets.com/arquivos/ids/213566/7703616275000.jpg?v=1752534079|Cencosud - Colombia|3 kg|2022-10-18|ARROZ
13405|arroz blanco diana premium x 1000 g|DIANA|El nuevo Arroz Diana Premium es un arroz altamente seleccionado. Escogemos los mejores, más blancos y más grandes granos para que lleguen a tu mesa y disfrutes con toda tu familia de un arroz espectacular|COP|5990.0|2023-05-09T22:02:37Z|https://www.tiendasjumbo.co/arroz-blanco-diana-premium-x-1000-g/p|https://jumbocolombiaio.vtexassets.com/arquivos/ids/186339/7702511000427.jpg?v=1752534181|Cencosud - Colombia|1 kg|2022-10-18|ARROZ
140189|arroz castellano premum jazmin x500 g|CASTELLANO|Arroz castellano premum jazmin x500g|COP|10390.0|2023-09-12T20:02:49Z|https://www.tiendasjumbo.co/arroz-castellano-premum-jazmin-x500g/p|https://jumbocolombiaio.vtexassets.com/arquivos/ids/214889/7702511073889.jpg?v=1752534340|Cencosud - Colombia|500 g|2022-10-18|ARROZ
129081|arroz diana premium x10 kg|DIANA|Arroz diana premium x10kg|COP|54990.0|2023-07-17T22:03:41Z|https://www.tiendasjumbo.co/arroz-diana-premium-x10kg/p|https://jumbocolombiaio.vtexassets.com/arquivos/ids/211638/7702206411699.jpg?v=1752534425|Cencosud - Colombia|10 kg|2022-10-18|ARROZ
13377|arroz florhuila x 3 kg|FLORHUILA|arroz descascarado al cual se le ha eliminado totalmente por elaboracion el germen y el salvado con adicion de vitamina A y acido folico|COP|13490.0|2023-08-28T22:09:31Z|https://www.tiendasjumbo.co/arroz-florhuila-x-3-kg/p|https://jumbocolombiaio.vtexassets.com/arquivos/ids/186293/7702231000035-Arroz-florhuila-vitaminas-x3000g--1-.jpg?v=1752534174|Cencosud - Colombia|3 kg|2022-10-18|ARROZ
22013|arroz supremo x 1000 g|SUPREMO|Arroz Supremo contiene una mezcla de vitaminas y minerales que contribuyen a la nutrición de tu familia.Contribuye al crecimiento y desarrollo del cuerpo y, ayuda a fortalecer el sistema inmunológico.Contribuye al buen funcionamiento del sistema inmunológico.|COP|4590.0|2023-10-14T22:12:59Z|https://www.tiendasjumbo.co/arroz-supremo-x-1000-g/p|https://jumbocolombiaio.vtexassets.com/arquivos/ids/191999/7701024000023-1.jpg?v=1752524224|Cencosud - Colombia|1 kg|2022-10-18|ARROZ
50668|arroz parbolizado doña pepa x 3000 g|DONA PEPA|Arroz descascarado al cual se le ha eliminado totalmente por elaboracion el germen y el salvado con adicion de vitamina A y acido folico|COP|18590.0|2023-09-12T20:02:45Z|https://www.tiendasjumbo.co/arroz-parbolizado-dona-pepa-x-3000g/p|https://jumbocolombiaio.vtexassets.com/arquivos/ids/209444/7702231300036-1.jpg?v=1752534323|Cencosud - Colombia|3 kg|2022-10-18|ARROZ
22037|arroz castellano premium oryzica x 1000 g|CASTELLANO|Es el único en Colombia que desde la semilla hasta el empaque es concebido para convertirse en el verdadero aliado en la cocina de los que saben diferenciar lo rico de lo exquisito.|COP|9790.0|2023-09-12T20:03:21Z|https://www.tiendasjumbo.co/arroz-castellano-premium-oryzica-x-1000g/p|https://jumbocolombiaio.vtexassets.com/arquivos/ids/192032/7702206010809.jpg?v=1752534180|Cencosud - Colombia|1 kg|2022-10-18|ARROZ
22002|arroz casanare x 5 kg|CASANARE|El grano de arroz más grande y rendidor. Seleccionado grano a grano desde el cultivo.|COP|20990.0|2023-08-28T22:12:46Z|https://www.tiendasjumbo.co/arroz-casanare-x-5-kg/p|https://jumbocolombiaio.vtexassets.com/arquivos/ids/191976/7703308010056-1.jpg?v=1752534983|Cencosud - Colombia|5 kg|2022-10-18|ARROZ
22024|arroz castellano premium integral oryzica x 1000 g|CASTELLANO|Lleva los mejores granos seleccionados especialmente para ti, incluye este producto en tu plato y ten una experiencia grandiosa.|COP|9990.0|2023-09-12T20:01:59Z|https://www.tiendasjumbo.co/arroz-castellano-premium-integral-oryzica-x-1000g/p|https://jumbocolombiaio.vtexassets.com/arquivos/ids/369623/7702206010861.jpg?v=1752534201|Cencosud - Colombia|1 kg|2022-10-18|ARROZ
28209|arroz diana premium coco x 1000 g|DIANA|Diana Premium es el arroz que siempre te hará quedar bien, ya que es 5 veces seleccionado, pasando por los mas estrictos estándares de calidad, para darte granos mas grandes, blancos, y enteros. Un gusto Premium que puedes disfrutar todos los días|COP|6590.0|2023-09-12T20:04:15Z|https://www.tiendasjumbo.co/arroz-diana-premium-coco-x-1000g/p|https://jumbocolombiaio.vtexassets.com/arquivos/ids/204418/7702511002391.jpg?v=1752534317|Cencosud - Colombia|1 kg|2022-10-18|ARROZ
13390|arroz roa x 1 kg|ROA|arroz descascarado al cual se le ha eliminado totalmente por elaboracion el germen y el salvado con adicion de vitamina A y acido folico|COP|4590.0|2023-08-28T22:07:31Z|https://www.tiendasjumbo.co/arroz-roa-x-1kg/p|https://jumbocolombiaio.vtexassets.com/arquivos/ids/186310/7702552000141.jpg?v=1752534178|Cencosud - Colombia|1 kg|2022-10-18|ARROZ
140191|arroz castellano premum basmati x500 g|CASTELLANO|Arroz castellano premum basmati x500g|COP|14990.0|2023-09-12T20:02:49Z|https://www.tiendasjumbo.co/arroz-castellano-premum-basmati-x500g/p|https://jumbocolombiaio.vtexassets.com/arquivos/ids/214891/7702511400760.jpg?v=1752534426|Cencosud - Colombia|500 g|2022-10-18|ARROZ
13409|arroz roa 10 x 2.5 kg|ROA|arroz descascarado al cual se le ha eliminado totalmente por elaboracion el germen y el salvado con adicion de vitamina A y acido folico|COP|14390.0|2023-09-12T20:02:42Z|https://www.tiendasjumbo.co/arroz-roa-10-x-2-5kg/p|https://jumbocolombiaio.vtexassets.com/arquivos/ids/186347/7702552200022.jpg?v=1752534187|Cencosud - Colombia|10   2.5 kg|2022-10-18|ARROZ
13384|arroz blanco máxima x3 kg|MAXIMA MP|Prepara deliciosas recetas con Arroz blanco maxima.|COP|10490.0|2023-08-28T22:12:50Z|https://www.tiendasjumbo.co/arroz-blanco-maxima-x-3-kg/p|https://jumbocolombiaio.vtexassets.com/arquivos/ids/186303/7703616076522.jpg?v=1752532992|Cencosud - Colombia|3 kg|2022-10-18|ARROZ
22049|arroz supremo premium x2500 g|SUPREMO|Arroz Supremo Premium es símbolo de la excelencia del arroz colombiano. El arroz 100 % seleccionado de grano blanco y largo, que al cocinar crece entero y parejo para darte a ti y a tu familia el sabor natural del mejor arroz de Colombia.|COP|14590.0|2023-10-14T22:07:45Z|https://www.tiendasjumbo.co/arroz-supremo-premium-x2500-g/p|https://jumbocolombiaio.vtexassets.com/arquivos/ids/192040/7701024001143-1.jpg?v=1752534903|Cencosud - Colombia|2.5 kg|2022-10-18|ARROZ
13402|arroz florhuila platino blanco x 2.5 kg|FLORHUILA|arroz descascarado al cual se le ha eliminado totalmente por elaboracion el germen y el salvado sometido a una estricta clasificacion la cual permite obtener grano blanco entero con minimos de partido|COP|14390.0|2023-09-12T20:02:42Z|https://www.tiendasjumbo.co/arroz-florhuila-platino-blanco-x-2-5-kg/p|https://jumbocolombiaio.vtexassets.com/arquivos/ids/186333/7702231000189-1.jpg?v=1752534195|Cencosud - Colombia|2.5 kg|2022-10-18|ARROZ
50670|arroz parbolizado doña pepa x 5000 g|DONA PEPA|Arroz descascarado al cual se le ha eliminado totalmente por elaboracion el germen y el salvado con adicion de vitamina A y acido folico|COP|30590.0|2023-09-12T20:04:13Z|https://www.tiendasjumbo.co/arroz-parbolizado-dona-pepa-x-5000g/p|https://jumbocolombiaio.vtexassets.com/arquivos/ids/209453/7702231300043-1.jpg?v=1752534323|Cencosud - Colombia|5 kg|2022-10-18|ARROZ
13392|arroz diana fibra x 2500 g|DIANA|Proporciónale todo el amor a tu familia con el delicioso Arroz Diana|COP|13990.0|2023-09-12T20:02:02Z|https://www.tiendasjumbo.co/arroz-diana-fibra-x-2500-g/p|https://jumbocolombiaio.vtexassets.com/arquivos/ids/186318/7702511002216.jpg?v=1752535305|Cencosud - Colombia|2.5 kg|2022-10-18|ARROZ
22012|arroz casanare blanco x 3000 g|CASANARE|Grano más grande y rendidor. Seleccionado grano a grano desde el cultivo. Libre de químicos y preservativos. Bajo en Calorías.|COP|12590.0|2023-08-28T22:20:19Z|https://www.tiendasjumbo.co/arroz-casanare-blanco-x-3000-g/p|https://jumbocolombiaio.vtexassets.com/arquivos/ids/191996/7703308010049-1.jpg?v=1752534195|Cencosud - Colombia|3 kg|2022-10-18|ARROZ
13394|arroz diana fibra x 4000 g|DIANA|Proporciónale todo el amor a tu familia con el delicioso Arroz Diana|COP|21990.0|2023-09-12T20:06:25Z|https://www.tiendasjumbo.co/arroz-diana-fibra-x-4000g/p|https://jumbocolombiaio.vtexassets.com/arquivos/ids/186320/7702511002223.jpg?v=1752534616|Cencosud - Colombia|4 kg|2022-10-18|ARROZ
140190|arroz castellano premum risotto x500 g|CASTELLANO|Arroz castellano premum risotto x500g|COP|14590.0|2023-09-12T20:02:49Z|https://www.tiendasjumbo.co/arroz-castellano-premum-risotto-x500g/p|https://jumbocolombiaio.vtexassets.com/arquivos/ids/214890/7702206048314.jpg?v=1752534342|Cencosud - Colombia|500 g|2022-10-18|ARROZ
166893|arroz federal premium x2500 g|FEDERAL|Acompaña tus comidas con el delicioso arroz Federal premium|COP|14590.0|2023-07-02T22:03:11Z|https://www.tiendasjumbo.co/arroz-federal-premium-x-2500g-3458392/p|https://jumbocolombiaio.vtexassets.com/arquivos/ids/219798/7704277010498.jpg?v=1752534347|Cencosud - Colombia|2.5 kg|2022-10-18|ARROZ
22027|arroz castellano tarro x 3 kg|CASTELLANO|Arroz Castellano es el único en Colombia que desde la semilla hasta el empaque es concebido para convertirse en el verdadero aliado en la cocina de los que saben diferenciar lo rico de lo exquisito, gracias a los valores agregados en el producto que han sido potencializados.|COP|30990.0|2023-09-12T20:06:25Z|https://www.tiendasjumbo.co/arroz-castellano-tarro-x-3-kg/p|https://jumbocolombiaio.vtexassets.com/arquivos/ids/192018/7702206010984-1.jpg?v=1752534200|Cencosud - Colombia|3 kg|2022-10-18|ARROZ
22030|arroz rice salvaje integral x 793.8 g|RICE SELECT|Arroz Rice Salvaje Integral, perfecto para preparar deliciosas recetas y sorprender.|COP|43090.0|2023-05-19T22:30:55Z|https://www.tiendasjumbo.co/arroz-rice-selec-royal-bl-integ-salv-x-28/p|https://jumbocolombiaio.vtexassets.com/arquivos/ids/192019/74401760320-1.jpg?v=1752534906|Cencosud - Colombia|793.8 g|2022-10-18|ARROZ
140194|arroz castellano premium sushi x500 g|CASTELLANO|Arroz castellano premium sushi x500g|COP|8990.0|2023-09-12T20:02:15Z|https://www.tiendasjumbo.co/arroz-castellano-premium-sushi-x500g/p|https://jumbocolombiaio.vtexassets.com/arquivos/ids/214893/7702206496825.jpg?v=1752534431|Cencosud - Colombia|500 g|2022-10-18|ARROZ
22048|arroz supremo premium x 1000 g|SUPREMO|Arroz Supremo Premium es símbolo de la excelencia del arroz colombiano. El arroz 100 % seleccionado de grano blanco y largo, que al cocinar crece entero y parejo para darte a ti y a tu familia el sabor natural del mejor arroz de Colombia.|COP|5890.0|2023-10-14T22:03:13Z|https://www.tiendasjumbo.co/arroz-supremo-premium-x-1000-g/p|https://jumbocolombiaio.vtexassets.com/arquivos/ids/192037/7701024001136-1.jpg?v=1752535310|Cencosud - Colombia|1 kg|2022-10-18|ARROZ
13393|arroz diana fibra x 1000 g|DIANA|Proporciónale todo el amor a tu familia con el delicioso Arroz Diana|COP|5790.0|2023-09-12T20:06:25Z|https://www.tiendasjumbo.co/arroz-diana-fibra-x-1000g/p|https://jumbocolombiaio.vtexassets.com/arquivos/ids/186319/7702511002209.jpg?v=1752534615|Cencosud - Colombia|1 kg|2022-10-18|ARROZ
163676|arroz federal premium gourmet x2500 g|FEDERAL|Prueba los mejores productos para ti.|COP|20690.0|2023-03-12T22:01:31Z|https://www.tiendasjumbo.co/arroz-federal-premium-gourmet-x-2500g-3453911/p|https://jumbocolombiaio.vtexassets.com/arquivos/ids/213238/7704277078696.jpg?v=1752534231|Cencosud - Colombia|2.5 kg|2022-10-18|ARROZ
22004|arroz con vitamina caribe x 5000 g|CARIBE|Arroz blanco enriquecido con vitamina A y ácido fólico|COP|20490.0|2023-08-28T22:16:28Z|https://www.tiendasjumbo.co/arroz-con-vitamina-caribe-x-5000g/p|https://jumbocolombiaio.vtexassets.com/arquivos/ids/191980/7702206011189.jpg?v=1752534991|Cencosud - Colombia|5 kg|2022-10-18|ARROZ
13408|arroz florhuila integral x 1 kg|FLORHUILA|arroz al cual se le ha removido la cascara sin someterlo a ningun proceso posterior de elaboracion o trilla su apriencia es grano entero de color moreno|COP|5990.0|2023-09-12T20:02:41Z|https://www.tiendasjumbo.co/arroz-florhuila-integral-x-1-kg/p|https://jumbocolombiaio.vtexassets.com/arquivos/ids/186345/7702231000516.jpg?v=1752534195|Cencosud - Colombia|1 kg|2022-10-18|ARROZ
13388|arroz florhuila x 1 kg|FLORHUILA|arroz descascarado al cual se le ha eliminado totalmente por elaboracion el germen y el salvado con adicion de vitamina A y acido folico|COP|4590.0|2023-08-28T22:22:14Z|https://www.tiendasjumbo.co/arroz-florhuila-x-1-kg/p|https://jumbocolombiaio.vtexassets.com/arquivos/ids/186306/7702231000028.jpg?v=1752534181|Cencosud - Colombia|1 kg|2022-10-18|ARROZ
205954|arroz diana blanco fideos x460 g|DIANA|Arroz diana blanco fideos x 460g|COP|3190.0|2023-09-12T20:02:52Z|https://www.tiendasjumbo.co/arroz-diana-blanco-fideos-x-460g/p|https://jumbocolombiaio.vtexassets.com/arquivos/ids/382384/7702511009765.jpg?v=1752534416|Cencosud - Colombia|460 g|2022-10-18|ARROZ
31848|arroz caribe x 10 kg con vita+|CARIBE|El Arroz Caribe Excelso, se obtiene a partir de granos de arroz descascarados, pulidos, clasificados, sanos, limpios y libres de impurezas. Es un producto natural sin aditivos que mantiene todo el valor nutritivo del arroz. El Arroz Caribe de siempre ahora enriquecido con Vita+ (Vitamina A y Ácido Fólico).|COP|40590.0|2023-08-28T22:30:46Z|https://www.tiendasjumbo.co/arroz-caribe-x-10kg-con-vita/p|https://jumbocolombiaio.vtexassets.com/arquivos/ids/205139/7702206011349.jpg?v=1752534997|Cencosud - Colombia|10 kg|2022-10-18|ARROZ
55216|arroz roa parbolizado x 5000 g|ROA|Prepara tus mejores recetas con este arroz, con granos cultivados con los mayores estándares de calidad. Ideal para compartir con los que mas quieres.|COP|30590.0|2023-09-12T20:06:26Z|https://www.tiendasjumbo.co/arroz-roa-parbolizado-x-5000-g/p|https://jumbocolombiaio.vtexassets.com/arquivos/ids/195134/7702552010065-1.jpg?v=1752534324|Cencosud - Colombia|5 kg|2022-10-18|ARROZ
28204|arroz diana x500 g|DIANA|Arroz Diana x500g|COP|1990.0|2023-08-28T22:22:15Z|https://www.tiendasjumbo.co/arroz-diana-500g/p|https://jumbocolombiaio.vtexassets.com/arquivos/ids/400435/7702511000014.jpg?v=1752535899|Cencosud - Colombia|500 g|2022-10-18|ARROZ
23453|leche deslactosada alquería x 1100 ml x 6 und|ALQUERIA|La Leche Deslactosada Alquería aporta una gran cantidad de vitaminas y prebióticos ideales para el cuidado de toda familia.|COP|28790.0|2023-05-30T22:06:08Z|https://www.tiendasjumbo.co/leche-deslactosada-alqueria-x-1100ml-x-6und/p|https://jumbocolombiaio.vtexassets.com/arquivos/ids/403043/7702177008560.jpg?v=1752534420|Cencosud - Colombia|1100 ml  6 und|2022-10-18|LECHE
23481|leche entera alquería x 1100 ml x 6 und|ALQUERIA|La Leche Entera Alquería aporta una gran cantidad de vitaminas y prebióticos ideales para el cuidado de toda familia. Ademas del sabor y cremosidad único|COP|27190.0|2023-04-26T22:03:04Z|https://www.tiendasjumbo.co/leche-entera-alqueria-x-1100ml-x-6und/p|https://jumbocolombiaio.vtexassets.com/arquivos/ids/403035/7702177001790.jpg?v=1752535121|Cencosud - Colombia|1100 ml  6 und|2022-10-18|LECHE
23444|leche deslactosada alpina bolsa x6 unds x1100 ml|ALPINA|La Leche deslactosada Alpina es de fácil digestión, apta para personas intolerantes a la lactosa, buena fuente de proteína, calcio vitaminas y minerales.|COP|28590.0|2023-09-22T10:01:46Z|https://www.tiendasjumbo.co/leche-deslactosada-alpina-bolsa-x-6und-x-1100ml/p|https://jumbocolombiaio.vtexassets.com/arquivos/ids/192867/7702001029716-multiempaque-x6-unidades-leche-deslactosada-bolsa-1100ml.jpg?v=1752535322|Cencosud - Colombia|6 unds 1100 ml|2022-10-18|LECHE
206584|leche colanta entera bolsa uht x 6 und x 1000 ml cu|COLANTA|Leche colanta entera bol uht x 6 und x 1000ml c-u|COP|24790.0|2023-06-06T22:03:04Z|https://www.tiendasjumbo.co/leche-colanta-entera-bol-uht-x-6-und-x-1000ml-c-u/p|https://jumbocolombiaio.vtexassets.com/arquivos/ids/366351/7702129004961.jpg?v=1752536181|Cencosud - Colombia|6 und  1 l c/u|2022-10-18|LECHE
23482|leche entera alqueria supermegalitro 1.3 l sixpack|ALQUERIA|Aporta una gran cantidad de vitaminas y prebióticos ideales para el cuidado de tu familia.|COP|31590.0|2023-04-26T22:02:18Z|https://www.tiendasjumbo.co/leche-entera-alqueria-supermegalitro-x-1-3l-sixpack/p|https://jumbocolombiaio.vtexassets.com/arquivos/ids/403046/7702177009215.jpg?v=1752534526|Cencosud - Colombia|1.3 l|2022-10-18|LECHE
